{
  "decision_id": "cdec_2ba835456fac",
  "work_unit_id": "wu_run_ho01_cfg_baseline_root",
  "contract_ref": "cc_run_ho01_cfg_baseline_root",
  "result": "COMPLETED",
  "execution_succeeded": true,
  "verification_satisfied": true,
  "satisfied_clauses": [
    "execution_success",
    "required_outputs",
    "required_evidence",
    "verification",
    "dependency_closure",
    "child_closure",
    "graph_conditions"
  ],
  "unsatisfied_clauses": [],
  "blocking_reasons": [],
  "evidence_refs": [
    "att_cca70ff6cf70",
    "att_76fdeb0bcb10",
    "att_8c0f3015bbe6",
    "vr_c5662d35f46d",
    "evidence/runtime-run-cli/analysis-receipt.json"
  ],
  "decided_at": "2026-10-22T16:01:53.464Z"
}
