{
  "decision_id": "cdec_604857b4d142",
  "work_unit_id": "wu_run_ho01_cfg_candidate_root",
  "contract_ref": "cc_run_ho01_cfg_candidate_root",
  "result": "COMPLETED",
  "execution_succeeded": true,
  "verification_satisfied": true,
  "satisfied_clauses": [
    "execution_success",
    "required_outputs",
    "required_evidence",
    "verification",
    "dependency_closure",
    "child_closure",
    "graph_conditions"
  ],
  "unsatisfied_clauses": [],
  "blocking_reasons": [],
  "evidence_refs": [
    "att_fe064b76057d",
    "att_9e6c967599c0",
    "att_27324113fc69",
    "vr_626133fafd93",
    "evidence/runtime-run-cli/analysis-receipt.json"
  ],
  "decided_at": "2026-10-21T03:51:41.244Z"
}
